{
  "identity": "provider-neutral-runtime-visibility-completion-20261011-r1",
  "state": "CONSUMED_BEFORE_REMOTE",
  "prepared_commit_sha": "2a522321dfab0ced58a9dbdcb2fe4f85db4ff3a1",
  "workflow_sha256": "95fce4f215206f04a3265d263951323de733af2f21671d90c956c4e485a5ed33",
  "helper_sha256": "1bed104b486a48c9908cca770f888c1e8d4b09ab7e547c0c88c7f4f32203fd10",
  "plan_sha256": "37977ea261a1ac4561e5973fae6b704d79ac30db2e6779de98e6d67dbac9e48f",
  "schema_sha256": "3b51377ab0f88ed10e2a2fe1bb645ab6149cb34179df20bf412de15e9dc38349",
  "census_sha256": "bf9fc8fa4666f961f536c69397c326ac00eeca9f713f7e0a688adcbe13e0312d",
  "prior_evidence_sha256": "457eacb0f8e6f77c57d6d02d2b7fc5410eeee0a3302889e1d7d550a0d8a06109",
  "parser_dependency_sha256": "4e5c746374757d77baf053c46c7516f65298f3cedbd8d37f6dea09242e619ee6",
  "target_manifest_sha256": "8315eac39526ed97126c3b5f85df9e150afc63186c224a3820fb03103bf11828",
  "known_source_sha256": "6c5d726f96d56dac792ff739f87227926197891f1149b1dedeeac38e67128451"
}
